videoId,Title,UploadDate,VideoType,Duration,DurationInS,ViewCount,LikeCount,CommentCount
Uly7TYab6HE,"Peter Luger Cowboy Butter Tomahawk",2025-05-11,Short,40S,40,251174,13523,94
cw7nr8a7wH0,"7 Day Honey Cured Wagyu A5",2025-05-10,Short,39S,39,2597266,113235,592
D_QYRTqhtoQ,"Barbacoa French Dip Cheese Steak @owen.han",2025-05-08,Short,40S,40,496731,23130,112
KflDSgz4KIc,"Jumbo Tomahawk for David Beckham",2025-04-30,Short,56S,56,3214749,112761,558
3tSvjeJZjGI,"I Ranked the Best BBQ from EVERY Country",2025-04-23,Short,2M10S,130,5930330,353127,5142
Q3QiyVSaPZE,"I Challenged America’s Best Brisket",2025-04-22,Short,1M,60,4300488,194453,698
l1rAb8iNPcQ,"Grinding Every Animal Into One Burger @NickDiGiovanni",2025-04-21,Short,26S,26,6479367,205506,1885
pKuguDpmti4,"I Cooked the World’s RAREST Steaks",2025-04-11,Short,3M,180,5637515,306020,2082
gDfyZaujK6E,"I Found Bacon in This Fish…",2025-03-26,Short,36S,36,7206157,326348,918
OU4S0FSZkoI,"I Covered Lamb in Jam",2025-03-24,Short,32S,32,940054,61584,324
P9NbFXKQo-8,"Cowboy Butter Lobster Roll",2025-03-19,Short,40S,40,1211950,73585,428
Aw5vc8jGQCY,"$50 vs $300 vs $1,000 Brisket",2025-03-13,Short,1M6S,66,20309093,822125,2748
sMtfXxOt-3o,"Citrus Dry Aged Mahi Mahi",2025-03-04,Short,50S,50,2098596,149254,657
vzXULTmvWnk,"I Cooked the World’s CRAZIEST Eggs",2025-02-25,Short,2M5S,125,23273281,1679377,10601
4UEzMoGvkXQ,"1,000 Garlic Clove Lamb Leg",2025-02-19,Short,34S,34,3932294,243489,1093
vGx5zex1YCY,"7 Day Caramel Soaked Ribs",2025-02-19,Short,31S,31,1324470,97744,352
lp_Q393jAfw,"I Cooked 100lbs of Protein Pt 3",2025-02-13,Short,1M,60,1293528,93102,507
AByKJ0-wpEs,"I Cooked A 70lb Cow Leg",2025-02-12,Short,1M1S,61,3995667,247616,774
ig1rlhB5h1Q,"I stole a whole cow leg pt 1…",2025-02-11,Short,44S,44,3451751,174240,207
w4jDx6Wenjw,"World’s WORST Tasting Tuna",2025-02-10,Short,47S,47,3130098,157618,1258
QDBn3_WwbQo,"If you find yourself with 20 lobsters…",2025-02-02,Short,31S,31,4764706,334657,2534
d4Z4HnDTnSA,"The Lobster Hot Dog",2025-01-24,Short,37S,37,1351278,118716,506
kGS_WfpU82Q,"When steak put me in the hospital…",2025-01-14,Short,1M1S,61,6826333,497054,1315
39-CvROyYUQ,"7 Day Molasses Cured Tomahawk",2025-01-13,Short,41S,41,1978606,144955,515
UwfDi4tT5Og,"Jalapeño Dry Aged Wagyu A5",2024-12-28,Short,1M3S,63,3197902,204614,800
jPTERm5G4vM,"Deep Fried Prime Rib",2024-12-24,Short,34S,34,1631443,113068,320
OuM4JtRrIEI,"Prime Rib Texas Toast Sandwich",2024-12-20,Short,43S,43,813719,73365,205
5QuFBdoHReA,"The Perfect Prime Rib",2024-12-17,Short,1M11S,71,1803602,109216,619
7ED6rGme02E,"The Brisket Football (Cooked in Clay)",2024-12-16,Short,1M4S,64,19682039,1167275,2634
zAu4PRyKbu0,"Panda Express Ran Out of Chicken…",2024-12-13,Short,33S,33,699284,55725,309
21ohKsJQA1g,"I Tasted The World’s Most EXOTIC Meats",2024-12-12,Short,1M49S,109,9586993,631489,9694
-LCnCFHbbd8,"How to slice every type of steak…",2024-12-11,Short,1M16S,76,1086748,65606,171
Jgw-HUH55ys,"Pork Chop Accordion",2024-12-10,Short,45S,45,1061756,85598,505
68GyW48XoEU,"Dry Aged Camel",2024-12-06,Short,33S,33,2737716,160342,1115
_I8OQEtRNEc,"Buffalo Chicken Mac and Cheese",2024-12-04,Short,44S,44,824472,76751,325
O2E3ZIUho04,"7 Day Honey Cured Steak",2024-12-03,Short,32S,32,74669450,4039374,11069
AiijhzdSj5Y,"30 Tacos in 30 Hours",2024-12-01,Short,1M,60,1418069,96115,345
xGPQ2c1v5CI,"Jalapeño Popper Pork Belly Accordion",2024-11-27,Short,54S,54,1573263,132802,724
2X0eMqOzyHE,"The Perfect Thanksgiving Turkey",2024-11-26,Short,1M,60,1877965,121362,610
VG8fgE1e5_g,"How to Carve a Turkey",2024-11-25,Short,36S,36,3842775,280683,446
mOug1POqBHY,"Parm Wheel Dry Aged Steak",2024-11-25,Short,53S,53,7237578,501010,1583
cauLrvx8-Ew,"The World’s Crispiest Turkey",2024-11-24,Short,46S,46,5863195,385194,877
vpJIT3m1wik,"Prime Rib Pho",2024-11-23,Short,48S,48,584780,54359,417
r1KO1sWLU4M,"Why is this sandwich soggy...",2024-10-30,Short,32S,32,969238,70117,505
lSxNFw5muOk,"Monte Cristo Big Mac",2024-10-23,Short,41S,41,2332278,124222,977
34klRJM77Wk,"$200 Zebra Steak",2024-10-21,Short,27S,27,5073464,285310,2758
3stVLdXiAjw,"Truffle Parm Beef Hump",2024-10-18,Short,49S,49,1008242,70124,345
aQWn6QSUshY,"Forging The World’s Rarest Knife ($50,000)",2024-10-14,Short,45S,45,12539714,661394,5208
s8VNFro4k3c,"Salmon Pastrami (game changer)",2024-10-11,Short,21S,21,3513480,177808,401
ZPtCLU9rVvg,"Harvesting 3,000 lbs of Axis Deer",2024-10-09,Short,38S,38,2579584,120027,1033
c11YyI2PFVg,"Steak School: T-Bone",2024-10-04,Short,41S,41,2209471,114693,341
eIwOI0XLCTk,"Car Cooking: Max vs Costco Hot Dog",2024-09-27,Short,52S,52,4630475,355062,1093
gNGn90gVozA,"Chimichurri Stuffed Chicken",2024-09-25,Short,34S,34,901423,60386,198
Owxl9dQxqis,"$2,500 Lobster Gnocchi",2024-09-22,Short,48S,48,9788493,632720,2847
xqBQVqqCGY4,"Is this the perfect bite?",2024-09-18,Short,10S,10,5272900,280787,945
0bQ8whf9Bu0,"Best “it’s raw” comment wins (tomahawk BLT)",2024-09-11,Short,14S,14,8977431,439543,8750
E0QYtD8DZ_c,"Wagyu A5 vs 2500° Forge",2024-08-26,Short,44S,44,11559680,657514,1221
Zc0qKEfzKQo,"Live Fire Pork Belly Accordion",2024-08-19,Short,45S,45,5299307,312906,866
ZEh-qvsG3AE,"Porchetta Roasted in Chimichurri Salt",2024-08-16,Short,48S,48,3744770,174903,787
Xg5eyXFgmJo,"$1 vs $5,000 Mac and Cheese",2024-08-13,Short,1M,60,80522675,3608703,11844
pdp8epfX7jk,"Larry the Lobster Boil",2024-08-05,Short,53S,53,2552590,198309,1199
EI__pA1Rm2o,"3 Levels of Duck...",2024-07-31,Short,44S,44,2654992,196485,574
t2viyjJFNPA,"If you find yourself with a whole salmon...",2024-07-26,Short,36S,36,3897471,243270,1127
GfAf194V0KM,"Doctor said I need to eat more vegetables...",2024-07-19,Short,24S,24,10407061,622870,3480
6JtLxCszFsE,"$3,000 Wagyu A5 Meat Tower",2024-07-10,Short,28S,28,4024792,246276,1223
V0gUMXDDD0Q,"I almost burned down my neighborhood...",2024-07-06,Short,56S,56,654882,49650,248
k6PclBMD--E,"Whole Salmon BURIED in Citrus Salt",2024-07-03,Short,45S,45,7640252,581778,1305
gR8HUkMWF3o,"I took over a butcher shop for a day...",2024-06-29,Short,51S,51,943531,68981,252
S_qPNUVQd44,"Bacon makes EVERYTHING Better",2024-06-28,Short,41S,41,1706092,110989,525
qe9ao1BBhfI,"Deep Fried Dry-Aged Peking Duck",2024-06-25,Short,48S,48,1841556,140556,386
czPMeUtkQ-8,"$250 Wagyu A5 Slim Jim",2024-06-20,Short,39S,39,3752089,261851,643
JOoM3Qis_1U,"Don't watch if you hate butter and bacon...",2024-06-15,Short,47S,47,10114861,480227,1916
L5y_cvweBgQ,"$2,000 Wagyu Parm Pasta",2024-05-30,Short,36S,36,84831343,3236197,13233
kwfqjt-XBH8,"Cooking a Frozen Brisket",2024-05-26,Short,42S,42,1260017,101717,272
YW_YtcieURY,"Double Crunchwrap Cheeseburger",2024-05-22,Short,34S,34,2146552,153856,772
7z3WaCmKmWA,"Max vs Salt Bae (I disowned my sister)",2024-05-17,Short,29S,29,1922150,119314,424
U-IheOyI82U,"The Steak Review: Salt Bae ($1,000 tomahawk)",2024-05-15,Short,42S,42,3361611,190468,1285
uTpUh1iOcgQ,"Everything I ate in Hawaii (While harvesting invasive species)",2024-05-10,Short,58S,58,934531,66189,493
GQk9dJmLxXg,"I Turned Steak Into Bread",2024-05-01,Short,32S,32,9469820,578727,1684
5_tuvX5ZqKk,"Do you think he'll approve?",2024-05-01,Short,36S,36,2531698,174692,951
NvG2yteNJeo,"Does it Deep Fry? Beef Short Ribs",2024-04-30,Short,28S,28,1786540,136103,268
t6b4kl2jn5s,"Thor’s hammer cooked in fire salt…",2024-04-28,Short,1M,60,27134190,1448611,4165
5o9tKN4r8D8,"The World's Biggest Salmon Chip…",2024-04-27,Short,59S,59,5055773,350746,1010
u79myUBKyjA,"Day in the life at a beef jerky factory",2024-04-25,Short,58S,58,1327585,92206,301
XUP2UX-Ghsg,"Flying with frozen meat...",2024-04-19,Short,45S,45,6087937,409941,747
vGDWdPipx6g,"Cheap Wagyu A5 vs Expensive Grass-fed",2024-04-10,Short,30S,30,4957244,295961,648
Qf0bKgn5zvg,"Cooking for Friends (Fantasy Football Edition)",2024-04-02,Short,53S,53,5373928,344029,870
kBF-QMtCdsY,"Peking Brisket",2024-04-01,Short,49S,49,1038337,70728,256
KbXElPzIW7g,"Tomahawk Biggie Mac @albert_cancook",2024-03-18,Short,31S,31,7169663,429419,1168
BxqTHHAAmkQ,"The most important meeting of my life…",2024-03-12,Short,1M,60,2045817,153642,408
8Wofo0Pyt4o,"Crème Brûlée Pork Belly Burnt Ends",2024-03-04,Short,46S,46,9252867,383345,1837
whs9OexwT5o,"“Well Done” Wagyu A5 😳",2024-02-29,Short,36S,36,3863867,255455,1382
MO1u9sjNlio,"What should I call this?",2024-02-28,Short,9S,9,1952594,80315,2970
p0nwjMREcTs,"A special batch of jerky…",2024-02-25,Short,26S,26,3589438,167935,1130
NGrLLf_QMGc,"Deep Fried Pork Belly Accordion",2024-02-22,Short,22S,22,2129824,120222,551
reUbPP1a0_c,"30 Day Dry Aged Buffalo Brisket",2024-02-20,Short,53S,53,6973273,459047,581
AQJFGq1DEfY,"I caught her cheating on Valentine's Day...",2024-02-14,Short,45S,45,22308614,1160619,6098
KxM-5_FqIBM,"This was actually raw...",2024-02-13,Short,28S,28,3155888,171519,1608
PEbdJgWoZ8w,"Impress your valentine with…",2024-02-11,Short,29S,29,5461461,399467,1402
seEcFZGgtek,"Crispy Skin Buffalo Chicken Dip",2024-02-08,Short,45S,45,4158789,315055,765
LZwkkuEedDM,"World's biggest corn dog… meat sticks live at maxjerky.com!",2024-02-06,Short,22S,22,7168309,173787,1104
LhcdE6mJWX4,"She asked me to catch a fish...",2024-02-04,Short,26S,26,1642592,90498,532
O4ho8IOpmas,"Mango Habanero Pork Belly Twists",2024-02-01,Short,24S,24,1366202,82935,245
3eGqirz2P7Y,"Best “juicy” comment wins...",2024-01-25,Short,9S,9,2725896,119052,4961
0_SdRI7NdMw,"Homemade Wagyu A5",2024-01-24,Short,36S,36,3297362,217650,705
5HYPRF8ZPqQ,"Cooking a Prime Rib in 10lb of MSG",2024-01-12,Short,54S,54,6851331,477156,3389
T33JUBAig3c,"NYE King Crab Round 2",2024-01-08,Short,1M,60,11971245,740409,3110
n_-5Tob_EJQ,"24k Gold Dry Aged Ribeye",2023-12-31,Short,47S,47,1623451,100753,552
Wg3-dP4UGcE,"My Brothers Industrial Bakery",2023-12-27,Short,54S,54,4016361,283377,637
IwCzubRup54,"Chili Crisp Injected & Dry Aged Ribeye",2023-12-19,Short,34S,34,5448101,321609,602
ExQrrKffaK8,"Deep Fried Prime Rib",2023-12-18,Short,34S,34,2039983,123342,395
Jg5yjQrY-t8,"Not Your Average Chicken Bacon Ranch",2023-12-16,Short,19S,19,2945829,176463,554
Cq-qGAcChRM,"Steak & Happy Potatoes",2023-12-16,Short,36S,36,3578416,245102,790
pYwoOxWndls,"Car Cooking: Wagyu A5 Big Mac @itsQCP",2023-12-13,Short,40S,40,12358826,722756,880
PgW60Xw7f60,"The Perfect Prime Rib",2023-12-11,Short,46S,46,915402,66452,545
cC2d8zjCZPA,"The Pizzaball Sub",2023-12-07,Short,36S,36,649772,42594,326
GvWa-N_IWIE,"I accidentally made pink short ribs…",2023-12-03,Short,42S,42,2748308,182641,531
JX0_STmuigQ,"I Marinated Short Ribs for 10 Days...",2023-11-28,Short,47S,47,2239646,163121,419
8eCovKu12h4,"What I ate in China",2023-11-26,Short,51S,51,4485144,319135,1154
MchzmS7qu7A,"Wagyu A5 Steak Accordion",2023-11-24,Short,1M,60,4834418,322417,955
xNMTeHu8R8w,"Deep Fried Turkey",2023-11-19,Short,36S,36,7862302,509972,1163
jpqMxSKk1BQ,"How to Smoke Meat INDOORS",2023-11-16,Short,33S,33,7759814,508120,2078
0owVfqYgaJg,"Beef vs Tofu",2023-11-11,Short,20S,20,6655771,412928,3972
z9hiA5fhCOU,"The worst cooking appliance of all time...",2023-11-10,Short,14S,14,5942837,390337,1309
GWDUG2UnSjw,"A Plate of Bacon (literally)",2023-11-04,Short,29S,29,6354303,356205,1243
v5SdCKWQM3I,"Cooking Brisket in 10lbs of Salt",2023-11-01,Short,1M,60,25649570,1369030,4742
FoEfFtdwEgc,"The Cheapest Wagyu A5 I Could Find...",2023-10-27,Short,38S,38,4777018,288476,679
_LmRrKu401s,"Filet mignon... like a brisket?",2023-10-24,Short,49S,49,11946239,634530,1777
Twk0OmkN2gE,"A peace offering...",2023-10-20,Short,1M,60,13371966,895752,2492
X3ZfD7W1-cw,"Is it Flatbread or Pizza?",2023-10-18,Short,49S,49,8894922,510522,2707
KRspJcpai-Y,"When an old man gives you a chicken...",2023-10-10,Short,1M,60,2815843,225522,787
W9rsY4QG2NY,"Don't Make Promises You Can't Keep...",2023-10-02,Short,1M,60,56527790,2628698,6372
avhcZ6Iuv2w,"Wagyu Tallow Dry Aged Lamb Shoulder",2023-09-28,Short,52S,52,13983773,817784,2020
6ynfeCAzr0U,"Garlic Confit Cowboy Butter",2023-09-20,Short,29S,29,4129612,308313,551
fztZ-oIXQMk,"Chicharron Charcuterie Board",2023-09-11,Short,41S,41,15018579,851202,3373
wLyQXLeXdc8,"McDonald’s Beef Jerky",2023-09-10,Short,35S,35,2802377,186702,568
WkMPySeHKGY,"Rib Cap Wellington… Gordon’s not going to be happy",2023-09-02,Short,40S,40,1889671,126160,749
YYfB_R2TjLI,"The World's Most Expensive Beef Jerky",2023-08-29,Short,37S,37,2807181,228753,969
bf-Nksvtiww,"She Wanted Raw Lobster...",2023-08-22,Short,30S,30,17240289,661599,6681
KujgczNVy_Q,"Dry Aged Fish Catch & Cook",2023-08-18,Short,1M,60,2429382,202653,615
tIkCThaR4fc,"Seafood Feast on a Malaysian Fish Farm",2023-08-04,Short,44S,44,1276368,94150,638
mDw6gUIdOQs,"I Cooked a Wagyu Picanha Like a Brisket",2023-08-03,Short,30S,30,5533392,302012,947
s_CMAhCEc5g,"Candied Bacon Salmon Board",2023-07-31,Short,54S,54,6679160,369013,1547
pu9hyOkfV5c,"Grow a Weenie",2023-07-23,Short,19S,19,196854605,3106474,4946
BtkpYb__JG4,"Picanha Chip",2023-07-22,Short,40S,40,10166568,652694,4155
0kGtpQpRPRU,"Worlds Biggest Rack of Ribs",2023-07-21,Short,32S,32,3793265,257949,1343
IiChHK-mzeo,"Can I move to FL before my meat defrosts?",2023-07-20,Short,54S,54,8593452,618888,3147
f4k7ZB64YH8,"I Turned Salmon into Cotton Candy",2023-07-17,Short,26S,26,3086385,182769,1089
hl4hDyMBVvA,"Dry Aged Buffalo Chicken",2023-07-16,Short,44S,44,41334422,2078278,4026
i2xKkIQ8eNU,"Best ""it's raw"" comment wins",2023-07-14,Short,10S,10,9480533,480216,37232
jsrkJNd7bno,"How Chicken Jerky is Made",2023-07-13,Short,45S,45,2566767,170577,806
E9kgHa6wh-k,"Lobster Cheese Dog",2023-07-01,Short,40S,40,7250765,443363,2040
weO4irlRYuw,"Chili Crisp Dry Aged Duck",2023-06-24,Short,44S,44,3997096,277354,1322
yYLLFEvvaH4,"Forbidden Dorito Pt 2",2023-06-20,Short,15S,15,6665983,350355,1360
Hb63L9YPyZg,"Steak School: Picanha",2023-06-16,Short,44S,44,5237131,306360,989
JqNNYKSEVeE,"Fresh vs Dry Aged Duck",2023-06-14,Short,45S,45,5582165,360414,891
uLhAzMppX5A,"Chicharron Crunch Wrap",2023-06-08,Short,28S,28,6399664,301504,1366
swTdBdJC1L4,"My Biggest Regret",2023-05-21,Short,1M,60,45875150,2557395,7802
GnjVV-Dl-LI,"I Turned Pork Into Cotton Candy",2023-05-15,Short,43S,43,3195725,202830,1226
3mppFmB_HSA,"1,000 Pounds of Bacon Jerky",2023-05-10,Short,49S,49,11048080,513536,2466
aP_7yKOk6Ok,"A Very Average Steak (Sierra Steak School)",2023-05-05,Short,26S,26,13213850,817506,2237
tX0ZMeEkXGg,"My Professional Fishing Career",2023-05-04,Short,1M,60,6196619,451566,1170
8g6-d57Y7xE,"I Cooked a Furry Steak",2023-05-02,Short,37S,37,5573005,393943,4724
IvaUCK4IxAE,"$10,000 Dry Aged Tuna",2023-04-28,Short,37S,37,4400256,294431,964
s486nYbO80Y,"The Steak Review: Joshua Weissman’s Steak House",2023-04-25,Short,53S,53,4344250,274704,648
NP0kQndK4Fw,"Wagyu A5 Spam",2023-04-16,Short,1M,60,16751617,836203,2687
Ij-scaFkBrI,"The Budget Friendly Tomahawk",2023-04-10,Short,24S,24,21914244,965521,4991
AwgwwNQpvuw,"The Half Cow Beef-Chetta",2023-04-07,Short,53S,53,4036007,285741,1842
haIUqAmKqzo,"Can You Guess This Cut?",2023-04-05,Short,9S,9,1841825,80974,1559
rlRPQqKyICY,"The Best BBQ in KC is From Texas",2023-04-03,Short,34S,34,7163962,415510,1994
CkqxjtEyK7I,"I Feel Like a Traitor",2023-04-03,Short,34S,34,1753005,109896,483
UMUL5zvfpuw,"“I Can’t Believe It’s Not a Ribeye” (Steak School)",2023-04-01,Short,24S,24,1523003,108649,245
ZeDEaNJzAl8,"How Kansas City Thai BBQ is Made",2023-03-28,Short,34S,34,1546970,94159,348
czQhfN6PEcY,"The Craziest Meat Feast of My Life",2023-03-27,Short,47S,47,1084994,69702,336
i-xJWp2cfww,"The Filet Mignapple",2023-03-25,Short,13S,13,32470703,1098787,4597
iaH_z2raAPY,"The Pineapple Mignon",2023-03-25,Short,14S,14,6323483,330093,3595
5vOGbM3cBJw,"My Third Favorite Steak (Steak School)",2023-03-24,Short,26S,26,2811628,213749,430
FZLNlhOgp6U,"I Soaked a Ribeye in Coffee for 24hrs Then Dry Aged It",2023-03-14,Short,42S,42,6762124,439507,1979
4nmr6geoGHI,"Wasabi Crusted Toro Taco @valentinetb1",2023-03-09,Short,28S,28,1858621,103668,535
v1Yv8fS78bc,"Cooking a Brisket Like a Steak",2023-03-06,Short,48S,48,31993765,1646733,2838
XA1auynQxQI,"I Cooked Salmon on a Deserted Island",2023-03-03,Short,59S,59,7750949,567896,2584
n3ixz8Fgw1c,"How Alaskan Salmon Gets on Your Plate",2023-03-02,Short,44S,44,1850840,142844,298
QHlN4nte57Q,"First Class Airplane Food Review: Worth It?",2023-03-01,Short,49S,49,11425085,726493,3672
_K263qh9vyg,"$1 vs $1,000 Wine Taste Test",2023-02-24,Short,46S,46,2948183,231432,685
35hGDDyKiu0,"I Covered Briskets in Relish, Ketchup, Mayo and Mustard",2023-02-22,Short,47S,47,23099902,1359573,3523
1cPXvVxxckc,"Worlds Hottest Dry Age (9 Million Scoville)",2023-02-18,Short,55S,55,10985803,770696,2082
_Jev7bXNjyc,"Brisket vs Tofu",2023-02-14,Short,20S,20,39497783,1929795,16596
HTpzWqMD45o,"I Soaked a Ribeye in Whiskey for 24hrs Then Dry Aged It",2023-02-10,Short,42S,42,50773050,2365842,9087
8hHkdPDALiU,"The Rarest Steak I’ve Ever Cooked",2023-02-09,Short,27S,27,21937875,1070091,3178
oB8clo4UMEs,"I Ate a Freezer Burned Steak",2023-02-08,Short,42S,42,15038621,926329,1756
4e7LQOgLSCo,"We Out-Pizza’d the Hut @ryancantcook",2023-02-07,Short,23S,23,22262191,1022631,3978
vv48rmFo3lQ,"She Didn't Let Me Eat the Filet-O-Fish...",2023-02-06,Short,26S,26,3216133,173054,667
zqMMm47977g,"Dry Aging Turned This Steak Grey...",2023-02-04,Short,44S,44,3515498,230472,463
GAMY4Hp6s2A,"Best ""it's raw"" comment wins pt. 4",2023-02-03,Short,10S,10,26406098,588125,41494
H84MZlCK9TE,"Best Lamb I Ever Had",2023-02-02,Short,44S,44,1765448,130395,463
LcNNEZ9i-QA,"$300 New Years King Crab",2023-02-01,Short,49S,49,13446654,861545,2597
N0UVzw1W_Mw,"Brisket Stuffed Prime Rib",2023-01-20,Short,48S,48,6270764,396936,1033
lzapLX2bH3o,"Scallop Pasta ft. @itsQCP",2023-01-11,Short,42S,42,5622693,402603,1018
0zlG1Knt6ZA,"Steak Battles: Max vs Peter Luger",2023-01-07,Short,43S,43,4622475,288113,906
ZYjGfbTH4N0,"The Steak Review: Peter Luger Steak House",2023-01-06,Short,42S,42,5232227,283107,1490
nhmAAy0HYpA,"Dry Aged vs Dry Brined vs Wet Brined PULLED PORK",2022-12-30,Short,1M,60,9661274,692249,1287
scv7vniJ0wg,"Dry Aged Pulled Pork",2022-12-29,Short,39S,39,1448105,119543,348
i3h3uNbgBhE,"Dry Aged BRISKET Bacon BLT",2022-12-27,Short,50S,50,4096482,303490,983
RwTq-5tIcl0,"How to Trim a Dry Aged Brisket",2022-12-26,Short,33S,33,1855206,113837,184
r6cv2JCiLnw,"The Perfect Prime Rib",2022-12-22,Short,59S,59,5310533,336632,2205
b5RmtXKODPo,"Brisket Bread (made with ChefsTemp)",2022-12-15,Short,46S,46,8312792,613268,1516
yrFDWPJF4bs,"I Soaked a Ribeye in Wine for 24hrs Then Dry Aged It",2022-12-14,Short,52S,52,23965051,1449770,3379
ZLopuHdqjBc,"The Worlds Most Underrated Steak",2022-12-08,Short,40S,40,10960406,694057,2024
cDseYSjGYIc,"15 Day Marinated Brisket",2022-12-07,Short,47S,47,45318808,2472190,3420
zvktSuKszqk,"Short Rib Challah Bao",2022-12-07,Short,43S,43,1735953,116952,668
z5GPq_pkbR0,"Elk Loin Cooked Inside of Salt",2022-11-30,Short,46S,46,26390834,1376150,6795
SplCbOj2aTI,"What it was like celebrating holidays in China",2022-11-25,Short,1M,60,4066705,404221,931
aSVEV2EmHG8,"“The cutest thing you ever made” - My sister",2022-11-22,Short,40S,40,1905511,143150,640
SYyIbvTD2e8,"The Perfect Thanksgiving Turkey",2022-11-21,Short,1M,60,5476034,345920,1321
OoTiTqf7eZc,"Not Your Average Turkey… (Peking Turkey)",2022-11-19,Short,44S,44,6148059,502352,1737
-RG6rob2cNQ,"How to carve a Turkey 🦃",2022-11-18,Short,31S,31,5605953,349868,644
xCbATMWcb1g,"Cooking a FROZEN Steak",2022-11-16,Short,52S,52,32454053,1468898,3733
cNJteplOcNI,"Wagyu Tallow Dry Aged Prime Rib",2022-11-15,Short,46S,46,6693279,444465,1860
a4V3I_3JXac,"The Ultimate Surf & Turf",2022-11-12,Short,34S,34,2110748,144160,599
GGQUOD7K5nU,"Dry Aged Roast Beef Sandwich Ft. @NickDiGiovanni",2022-11-11,Short,31S,31,5848790,372704,1095
JZUKssceS00,"APPLEWOOD Liquid Smoke + Coffee Dry Age Pt.3",2022-11-09,Short,38S,38,2034463,173218,374
BDwni0c9zN4,"Powdered Smoke Dry Age Pt. 2",2022-11-08,Short,40S,40,4680556,358175,668
eHEd5XBr8wA,"Cold Smoked THEN Dry Aged Ribeye Pt. 1",2022-11-07,Short,45S,45,6504464,479235,891
AszOPmzcTmQ,"Cooking Steak with a Chef in Alaska",2022-11-06,Short,54S,54,3424323,285447,727
skL0m25Nj6Y,"Dry Aged Alligator (Nashville Hot Gator Sandwich)",2022-11-02,Short,59S,59,14476244,927749,12055
7X3qCbSQhnY,"I made my cats favorite food",2022-11-01,Short,52S,52,9909107,753833,3016
3zypsd9C2sE,"The Ultimate Triple Decker Burger",2022-10-31,Short,49S,49,1709596,163278,826
fwEV4l_gUQE,"Smoked Bourbon Marinated Brisket",2022-10-27,Short,35S,35,1832174,157063,574
CKZN1IfYvC4,"Wagyu Short Rib Hot Pocket",2022-10-26,Short,40S,40,2115169,200100,505
PYm4q_L4bII,"What I Used to Eat at Sleep Away Camp…",2022-10-25,Short,1M,60,2624483,266841,568
Eu_OoXXhLVs,"Duck Balls…",2022-10-24,Short,39S,39,8029030,463966,7124
MQgoIhyc1Jo,"The Brisket Baby",2022-10-23,Short,8S,8,2253247,100563,821
vwnMpfPNyes,"I Made Salmon Dumplings in Alaska",2022-10-22,Short,50S,50,12919542,851029,5249
mqvSULs1a8Q,"Smoked Beef Heart",2022-10-21,Short,46S,46,3029710,275392,1401
cMf3YuR3JUE,"The hardest job I ever had…",2022-10-18,Short,1M,60,17072721,1320016,3428
8W8Au81_gTs,"Best “it’s raw” comment wins…",2022-10-17,Short,12S,12,33411715,1466926,102955
Oz6tS6TLs1o,"Gochujang Sesame Dry Age",2022-10-16,Short,48S,48,5628798,453504,1104
OBhEz6QjmoU,"What I Ate in Alaska… but it keeps getting weirder",2022-10-12,Short,48S,48,2381467,217775,1095
uo1E2vFhAO0,"Pulled Pork Ice Cream",2022-10-03,Short,43S,43,2470266,133526,617
EPudgBJ8uy4,"“Meat” Balls (Rocky Mountain Oysters)",2022-09-29,Short,29S,29,12895781,438053,7306
SU8rvi4AzKM,"Turned 30 so Made Beef Cheeks",2022-09-27,Short,9S,9,1240829,82693,596
NPfS-7ma2gY,"Beef Tongue Tacos",2022-09-22,Short,39S,39,21227964,1074370,9391
LHYPFaQzttw,"I Ate a Whole Pig (Bachelor Party Pig Pt. 3)",2022-09-17,Short,43S,43,9646497,469213,6059
io5F83eFTkM,"I Bought a Pig (Bachelor Party Pig Pt. 1)",2022-09-15,Short,58S,58,47069770,1866797,17929
qW8EYGkZLvc,"The Steak Biggie Mac @albert_cancook",2022-09-08,Short,33S,33,74517682,2892118,6075
KKkF70aah3s,"Spicy King Crab Pasta @itsQCP",2022-09-02,Short,37S,37,6073796,503446,1489
dFh9heGhH_I,"Wagyu Tallow Injected Beef Cheeks",2022-08-25,Short,39S,39,7799463,570105,2925
wKbPJxkiq3c,"Pulled Pork Cooked in Clay",2022-08-19,Short,34S,34,3417861,248917,982
HvM5uz3s0BI,"Grilled Branzino with Salmon Egg Beurre Blanc @hwoo.lee",2022-08-18,Short,31S,31,4720942,326403,980
afKfHQ8TdtI,"Chicken Cooked in Clay (Beggar’s Chicken)",2022-08-17,Short,43S,43,43328577,2286344,8838
J7MWMKAHTZQ,"Chicken 🥪 with the sandwich king himself @owen.han",2022-08-12,Short,56S,56,11685613,971524,1463
Z7kYMjQbCKg,"Octopus",2022-08-11,Short,31S,31,11656898,469442,1488
OHqc1Lp8lFU,"Mahi Mahi Tacos",2022-08-10,Short,52S,52,6750871,628970,1918
12DbLCBVIWw,"Car Cooking: Max vs Buffalo Wild Wings",2022-08-09,Short,53S,53,3019667,311695,728
gOlBrPXrFxA,"Deconstructed Smoked Chicken",2022-08-02,Short,37S,37,11665849,859801,2038
41HFHXmc8Ww,"Lamb Brisket vs. Wagyu Brisket @GugaFoods",2022-07-28,Short,31S,31,3789980,290463,696
vJUiXU4xLeQ,"The Frankenstein Roast",2022-07-27,Short,58S,58,16409306,1236251,4200
lkB_4ZPLPl8,"The steak accordion (I did something bad)",2022-07-25,Short,42S,42,37338915,2541945,7536
dNbNPmxVuWQ,"3 Chicken Wing Mistakes to Stop Making (#3 is game changer)",2022-07-23,Short,47S,47,4425149,386972,2149
pojfDzs5nU4,"I suck at making spring rolls @LisaNguyen",2022-07-22,Short,49S,49,6776938,534094,2763
ArpkopAmU9M,"Seasoning a steak with the crust of another steak",2022-07-21,Short,38S,38,34791655,2144154,9652
Q41FRd8mREk,"Rare Japanese Knives (Korin Knife Shop)",2022-07-20,Short,46S,46,7857495,597784,1643
gFfU1RDESmM,"I tasted the dry aged impossible meat…",2022-07-19,Short,43S,43,43368292,2539742,13200
swNm2DvC5uE,"Jumbo Chili Cheese Dog",2022-07-06,Short,29S,29,323240586,5653912,23545
PJnb5spG7lU,"Simple Crispy Pork Belly",2022-07-01,Short,28S,28,6285068,336073,1831
H5RMhDvE7Yk,"Wagyu A5 Beef Tartare Burger",2022-06-24,Short,20S,20,15109083,740528,4052
Yv2ohC5f5mg,"Dry Aged Salmon",2022-06-21,Short,40S,40,16607214,1110860,2674
pyRZyE_yAPo,"My Favorite Instant Ramen Recipe pt. 14",2022-06-18,Short,58S,58,13170438,1043541,4252
xJIPlqTvUSk,"I think Gordon hates me",2022-06-17,Short,32S,32,24145383,1237266,7460
CJU6XUBr4gY,"Black Garlic Dry Aged Ribeye",2022-06-16,Short,33S,33,5619652,381139,1429
p812v2g5tvA,"Popcorn Pork",2022-06-07,Short,10S,10,68827275,2221632,19448
zPjZnPJ2K-o,"4 Butter Basting Mistakes to Stop Making",2022-06-03,Short,48S,48,30648535,1647901,3930
R2Fi2I6RSgk,"Dry Aged Impossible (Vegan) Meat",2022-05-31,Short,17S,17,13743065,691087,6480
YYFlLferi5o,"Ghost Pepper Lamb Chops at Michelin Star Restaurant",2022-05-22,Short,35S,35,2505472,177770,407
TAp87nKCX_E,"Wagyu A5 Filet Mignon Tartare",2022-05-16,Short,44S,44,13133827,773630,3300
9ZUDUG3Im_U,"150 Day Dry Aged Spam",2022-05-11,Short,26S,26,58060566,2800584,7320
dW9w97Afcws,"Maple Habanero Pork Twists",2022-05-06,Short,23S,23,17517819,730007,1436
DMChBhNr08g,"The Holy Grail of Beef",2022-05-05,Short,30S,30,6940058,436511,1642
2FWrcTLYegM,"Whole Cod Fish and Chips 🐟",2022-05-03,Short,48S,48,4317700,299540,1668
5TrcrM_ooiw,"Tajin Tequila Dry Age",2022-05-01,Short,52S,52,5261306,501448,1043
ianyoKUMwK4,"A spicy steak on top of Google ft. @LisaNguyen",2022-04-29,Short,30S,30,6178968,442748,1998
77KIbqv2eEM,"Deconstructed Prime Rib",2022-04-28,Short,1M,60,19390816,1323065,3884
g-hPtKGb8yo,"A hen in her nest 🐓",2022-04-19,Short,1M,60,10608379,768129,2505
Ahx2YptGw3I,"Pork Brisket vs Bison Brisket ft. @GugaFoods",2022-04-13,Short,35S,35,9641680,680475,2237
YQ15ugO3eI8,"Pork Chips and Salsa",2022-04-12,Short,28S,28,2409836,169635,738
PqU8NtHBgCk,"Steak Pizza ft. @GugaFoods",2022-04-07,Short,32S,32,28838137,1538702,7931
GXpioNviYl4,"Everything I ate on a luxury cruise",2022-04-05,Short,59S,59,9977657,715452,3200
EleODaehtgo,"The Steak Monster 😈",2022-04-02,Short,1M,60,114518079,6205146,16387
