videoId,Title,UploadDate,VideoType,Duration,DurationInS,ViewCount,LikeCount,CommentCount
EeXCDpuc5B4,"Are People SERIOUSLY Surprised by Nintendo's Greed?",2025-05-19,Long Form,10M8S,608,70027,4908,1661
V131pGDHVXA,"China has beaten Disney at their own game.",2025-04-30,Long Form,11M43S,703,47057,3052,745
Qv5LFfwbBZE,"Dealing with POINTLESS Tech and FAKE Convenience",2025-03-01,Long Form,27M29S,1649,67265,4538,1347
VDpQkYQpK5A,"Somehow...the Rise of Skywalker was WORSE than I remembered.",2025-01-18,Long Form,1H49M57S,6597,145628,5662,1507
buNQKzElN1s,"Does FAMILY GUY deserve the HATE?",2024-12-09,Long Form,30M5S,1805,201637,8040,1523
lNMqhn8Dcgo,"Most movie ""HATE"" is justified.",2024-09-30,Long Form,20M1S,1201,175472,9317,2094
YOkOp-UP5is,"An Honest Conversation about the Phantom Menace",2024-09-09,Long Form,36M54S,2214,86139,3648,1273
jAMPdjRcSZE,"Are TF2 players...entitled?",2024-08-02,Long Form,34M17S,2057,118370,5722,2102
2SgSuQNNMxo,"Valve's new game looks like CERTIFIED TRASH™",2024-06-04,Long Form,23M2S,1382,291577,12746,6137
4y290h4lUhg,"Emp Recommends | Max Mad: Fury Road",2024-05-25,Long Form,27M56S,1676,17825,1065,215
k0g2voba4AQ,"Pixar used to be Special",2024-02-29,Long Form,35M47S,2147,271722,12807,2128
eHwdIV4YXP4,"Dealing With the New Age of Illiteracy",2024-02-18,Long Form,45M24S,2724,83913,3905,1512
7uql6wX9lvU,"Does anyone actually care that you worked hard?",2024-01-12,Long Form,21M59S,1319,30453,1597,362
1RsndHPXxLc,"Dealing With the Boomer Work Ethic",2023-12-23,Long Form,27M2S,1622,108650,5110,1566
eR9U5U4JYfs,"Be Careful what you Work For",2023-11-21,Long Form,19M41S,1181,25907,1628,246
CKRYYUCviLY,"Dealing With the Declining Standard of Living",2023-11-12,Long Form,20M32S,1232,35584,2030,385
E_2dLp_t_LE,"Interview with Fishtank Creator Jet Neptune",2023-10-08,Long Form,1H29M6S,5346,42189,1886,219
5SY8-yzaPSU,"Dealing With the Lack of Progress in Society",2023-08-28,Long Form,20M20S,1220,24638,1534,382
B5MlU7H926U,"More Thoughts on Student Debt",2023-07-25,Long Form,26M38S,1598,12848,647,288
MImAOQBk97E,"Thoughts on Student Loan Forgiveness",2023-07-03,Long Form,25M9S,1509,20242,1086,419
yNVlGvAh7ng,"DOWNWARD DRIVE: Episode 7 - Brandon Buckingham",2023-06-12,Long Form,58M,3480,7317,312,55
fdeixfLiLDw,"Dealing with Treacherous Rural Police",2023-05-30,Long Form,26M38S,1598,16888,824,193
iaqFrNTSJ1U,"Dealing with Misfortune",2023-05-26,Long Form,27M54S,1674,15093,752,95
pFh82Ej76JY,"The Critics were WRONG about the Mario Movie (ft. The Kino Corner)",2023-05-20,Long Form,28M24S,1704,17081,758,241
9q9S2OAJyK4,"DOWNWARD DRIVE: Episode 6 - GamerFromMars",2023-05-17,Long Form,1H14M56S,4496,6782,290,36
03vyVcDFen8,"We stayed in a NIGHTMARE AirBNB (ft. Rusty Cage)",2023-05-14,Long Form,25M47S,1547,9758,533,86
IgOmmqV8xt8,"I am once again asking iDubbbz to stop embarrassing himself.",2023-05-11,Long Form,33M14S,1994,56581,2599,642
QyXc-TmSpx8,"DOWNWARD DRIVE: Episode 5 - Huggbees",2023-04-28,Long Form,1H11M45S,4305,7565,414,52
9kf3au1Ccoc,"RETURN TO TALLADEGA",2023-04-24,Long Form,1H,3600,8154,412,46
59g9ZNaxJK0,"Fishtank Live will change online creation as we know it",2023-04-19,Long Form,15M26S,926,30002,1625,389
tJCMbXd0c1Y,"The YouTube Community Has Turned on iDubbbz",2023-04-13,Long Form,25M17S,1517,40139,2101,393
QFHGo7trqek,"The SCAMMIEST Traffic Ticket",2023-04-11,Long Form,38M15S,2295,15992,919,250
bx_m6TnbwP8,"BEHIND THE MEME! Let's Go for a Drive...",2023-04-01,Long Form,8M27S,507,13981,656,94
A35sm_O8YWQ,"Can we stop trying to make ""Spring Football"" a thing?",2023-03-30,Long Form,19M41S,1181,6184,323,102
i56N_vnHkVc,"iDubbbz has turned into an Unimaginable Prude",2023-03-26,Long Form,23M41S,1421,50787,2965,515
XMDs5dio6GI,"The CVS POOP Conspiracy",2023-03-20,Long Form,17M34S,1054,7810,419,103
GAYlv-56yv4,"PANIC MONDAY: Florida Bank BURNED TO THE GROUND by IRATE Customers. TRILLIONS Erased.",2023-03-16,Long Form,9M50S,590,5353,295,56
TWGluUFEGr8,"The Compound-Last-Name DOOMSDAY Hypothesis",2023-03-14,Long Form,20M11S,1211,14127,807,219
DYlYsrUU2VI,"THE FALL OF CIVILIZATION | World War W",2023-03-01,Long Form,20M19S,1219,9351,453,122
Kbgm4r0eobg,"We should expect to be disappointed by reboots.",2023-02-21,Long Form,11M34S,694,10559,483,101
SsDbhx65BgI,"FINAL MESSAGE to Star Wars Fans",2023-02-18,Long Form,22M36S,1356,21476,963,297
45uZJFsWhuE,"My Shattered Hopes and Dreams - A Star Wars Story",2023-02-11,Long Form,37M29S,2249,34007,1278,230
cnKooTd_x-k,"I don't enjoy playing video games anymore.",2023-02-08,Long Form,37M23S,2243,33770,1350,463
eptfYSBcpYU,"GASLIT at Waffle House | WORLD WAR W",2023-02-05,Long Form,10M37S,637,6103,416,78
BrXJMEsKBkg,"No, I will not watch your THREE HOUR LONG piece of crap movie.",2023-01-21,Long Form,10M9S,609,13139,695,164
4Z5v155bomc,"DOWNWARD DRIVE: Episode 4 - The Sobcast Reunion",2023-01-18,Long Form,45M18S,2718,2405,82,20
x7J5bbYhwgs,"Rick and Morty is FINISHED.",2023-01-16,Long Form,23M58S,1438,29654,1151,225
jt50ygjmgRA,"Please STOP STEALING Our Totally Unsupervised Inventory!!!",2023-01-12,Long Form,13M25S,805,26359,1378,340
xnG_vLPJDGQ,"DOWNWARD DRIVE: Episode 3 - BG Kumbi",2022-12-26,Long Form,55M25S,3325,3883,169,23
b0spEt8hNGc,"You Fools...",2022-12-21,Long Form,10M13S,613,6041,408,121
IzEEro5cexc,"Can you people SHUT YOUR DOGS UP",2022-12-15,Long Form,16M19S,979,16101,1079,307
UrYGnmeW2BY,"Tricked into Downloading Malware",2022-12-14,Long Form,10M43S,643,6337,440,36
DX5cwR5tIN4,"Welcome Back BehindTheMeme!",2022-11-30,Long Form,10M9S,609,13504,780,152
LbYl_nHzGi0,"You shouldn't feel proud for blocking ads on YouTube",2022-11-29,Long Form,31M,1860,18593,626,252
v2gpGjXlCRM,"DOWNWARD DRIVE: Episode 2 - S1apSh0es",2022-11-28,Long Form,36M24S,2184,6787,243,24
v9vBggRIZ6Y,"The Making of 'American Psychos'",2022-11-22,Long Form,21M37S,1297,10348,709,140
reUkOsJRe2E,"New Regime, Same Old Twitter",2022-11-17,Long Form,21M39S,1299,15173,760,139
-5CSkTSJhKM,"Dealing with YouTube's B.S.",2022-11-12,Long Form,20M57S,1257,5458,366,29
F5vqmdwMtSg,"DOWNWARD DRIVE: Episode 1 - wavywebsurf",2022-11-03,Long Form,1H4M58S,3898,7197,419,66
cl85m3w9GVo,"New Age of Crappy Products",2022-10-15,Long Form,6M8S,368,6310,442,86
hGfww6IlKmQ,"$200 Crunchy Glasses",2022-10-06,Long Form,8M23S,503,2846,255,44
8qmTT2_JGfM,"The Importance of Starting Fresh",2022-09-30,Long Form,10M49S,649,3769,302,38
csU6c_VYzns,"Have Streaming Services Jumped the Shark?",2022-09-21,Long Form,6M59S,419,5907,444,47
I6kKopaP2T8,"Tooth Trouble",2022-09-10,Long Form,16M37S,997,3650,286,57
vHXhzxWIspg,"You and the Audience",2022-09-08,Long Form,22M5S,1325,6805,499,72
kNJhipHySV8,"What would you say...ya do here?",2022-09-04,Long Form,6M2S,362,3621,397,57
kOInMgqtO98,"Dear Downward Diary...",2022-09-03,Long Form,11M23S,683,10717,880,152
